{
    "metadata": {
        "source": "../experiments/outputs/gpt-4/tr/btwd/temp_en/final/v_final_default_zs_cot/batch2_sample10/btwd_default_final_morph_batch2_sample10_eval_morph_gen_cot_en_s0_gpt-4_32930f0f3f37.json",
        "processor": "",
        "language": "tr"
    },
    "data": [
        {
            "id": "tr-btwd-e7de2fec",
            "root": "anak",
            "prefixes": [],
            "suffixes": [
                "tan"
            ],
            "meta_prefixes": [],
            "meta_suffixes": [
                "DAn"
            ],
            "derivation": "anaktan",
            "reference": "anaktan",
            "sentence": "kafamın içine bilmediğim şeyleri ___ yerleştirmeye çalışan bir yazar, beynimizi uzun vadede istek ve ihtiyaçlarımıza göre şekillendirdiğimizi söylerken, içimden kararlarımı etkileyen beynin gücünü yabana atmamam gerektiğini söyleyen sesler yükseliyor",
            "cot_answer": "To answer the question, we will first use the novel word's definition to derive an existing word in Turkish that has the same meaning and then replace the root in this derivation with the given novel root. Given novel root \"anak\" is defined to mean \"uzak\", so let's first try to derive a new word from \"uzak\" using the given affixes. To construct a grammatically correct word in Turkish, we need to append the given affix to the root. In this case, we have the root \"uzak\" and the affix \"tan.\"\n\nThe affix \"tan\" can be used to form a noun in the ablative case, indicating \"from a distance\" or \"from afar.\"\n\nSo, by appending \"tan\" to \"uzak,\" we get \"uzaktan,\" which means \"from a distance\" or \"from afar.\"\n\nEach affix used in the construction of the word:\n- tan (ablative case suffix)\n\nNow we replace the root \"uzak\" in \"uzaktan\" with our novel root \"anak\" to get the final answer \"anaktan\".\n\nFinal answer: <Answer>anaktan</Answer>",
            "id_root": "uzak",
            "ood_root": "anak",
            "id_derivation": "uzaktan",
            "answer_suffix": "\n\nNow we replace the root \"uzak\" in \"uzaktan\" with our novel root \"anak\" to get the final answer \"anaktan\".\n\nFinal answer: <Answer>anaktan</Answer>"
        },
        {
            "id": "tr-btwd-d196a449",
            "root": "çasar",
            "prefixes": [],
            "suffixes": [
                "ıl"
            ],
            "meta_prefixes": [],
            "meta_suffixes": [
                "Hl"
            ],
            "derivation": "çasarıl",
            "reference": "çasarıl",
            "sentence": "sonunda benim kendi payıma aldığım ise şu sanırım bayan ming’in öyküsünden: şimdi sahip olduklarının farkına var ve bundan sonra hayatın sana sunacağı armağanlara daha sıkı ___",
            "cot_answer": "To answer the question, we will first use the novel word's definition to derive an existing word in Turkish that has the same meaning and then replace the root in this derivation with the given novel root. Given novel root \"çasar\" is defined to mean \"sar\", so let's first try to derive a new word from \"sar\" using the given affixes. To construct a grammatically correct word in Turkish, we need to append the given affix to the root. In this case, we have the root \"sar\" and the affix \"ıl\".\n\nStep 1: Append the affix \"ıl\" to the root \"sar\" to form the word.\n\nThe resulting word is \"sarıl\" which means \"to hug\" in Turkish.\n\nAffix used:\n- ıl\n\nNow we replace the root \"sar\" in \"sarıl\" with our novel root \"çasar\" to get the final answer \"çasarıl\".\n\nFinal answer: <Answer>çasarıl</Answer>",
            "id_root": "sar",
            "ood_root": "çasar",
            "id_derivation": "sarıl",
            "answer_suffix": "\n\nNow we replace the root \"sar\" in \"sarıl\" with our novel root \"çasar\" to get the final answer \"çasarıl\".\n\nFinal answer: <Answer>çasarıl</Answer>"
        },
        {
            "id": "tr-btwd-53204d06",
            "root": "raru",
            "prefixes": [],
            "suffixes": [
                "ndan"
            ],
            "meta_prefixes": [],
            "meta_suffixes": [
                "NDAn"
            ],
            "derivation": "rarundan",
            "reference": "rarundan",
            "sentence": "ama ___ sonra monroe sadece güzel sarışın değil, cinsiyetini arkasında bırakmış bir zeka olarak karşımdaydı",
            "cot_answer": "To answer the question, we will first use the novel word's definition to derive an existing word in Turkish that has the same meaning and then replace the root in this derivation with the given novel root. Given novel root \"raru\" is defined to mean \"bu\", so let's first try to derive a new word from \"bu\" using the given affixes. To construct a grammatically correct word in Turkish by appending the given affix to the root \"bu,\" we will follow the steps below:\n\n1. Identify the root: \"bu\"\n2. Identify the affix: \"ndan\"\n3. Append the affix to the root: \"bu\" + \"ndan\" = \"bundan\"\n\nNow, let's verify adherence to the rules:\n- The affix \"ndan\" is used exactly once.\n- All provided affixes are used.\n- No extra affixes outside the provided list are included. List of affixes used in the construction of the word:\n- ndan\n\nNow we replace the root \"bu\" in \"bundan\" with our novel root \"raru\" to get the final answer \"rarundan\".\n\nFinal answer: <Answer>rarundan</Answer>",
            "id_root": "bu",
            "ood_root": "raru",
            "id_derivation": "bundan",
            "answer_suffix": "\n\nNow we replace the root \"bu\" in \"bundan\" with our novel root \"raru\" to get the final answer \"rarundan\".\n\nFinal answer: <Answer>rarundan</Answer>"
        },
        {
            "id": "tr-btwd-c1411ae5",
            "root": "ciki",
            "prefixes": [],
            "suffixes": [
                "len"
            ],
            "meta_prefixes": [],
            "meta_suffixes": [
                "lAn"
            ],
            "derivation": "cikilen",
            "reference": "cikilen",
            "sentence": "oturulan mekânın, ___ yemeğin hiçbir önemi yoktur aslında çünkü sen arkadaşlarınla birlikte yine aynı şeylere gülecek, aynı şeylere ağlayacaksın",
            "cot_answer": "To answer the question, we will first use the novel word's definition to derive an existing word in Turkish that has the same meaning and then replace the root in this derivation with the given novel root. Given novel root \"ciki\" is defined to mean \"yeni\", so let's first try to derive a new word from \"yeni\" using the given affixes. To construct a grammatically correct word in Turkish by appending the given affix to the root \"yeni\", we will follow the steps:\n\n1. Take the root \"yeni\".\n2. Append the affix \"len\" to the root.\n\nThe resulting word is \"yenilen\".\n\nNow, let's list each affix used in the construction of that word:\n\n- \"len\" (makes the word mean \"to be renewed\" or \"to renew oneself\")\n\nWe have used the affix \"len\" exactly once, and there are no other affixes provided in the list. We have not included any extra affixes outside the provided list.\n\nNow we replace the root \"yeni\" in \"yenilen\" with our novel root \"ciki\" to get the final answer \"cikilen\".\n\nFinal answer: <Answer>cikilen</Answer>",
            "id_root": "yeni",
            "ood_root": "ciki",
            "id_derivation": "yenilen",
            "answer_suffix": "\n\nNow we replace the root \"yeni\" in \"yenilen\" with our novel root \"ciki\" to get the final answer \"cikilen\".\n\nFinal answer: <Answer>cikilen</Answer>"
        },
        {
            "id": "tr-btwd-ea3e60bb",
            "root": "vısun",
            "prefixes": [],
            "suffixes": [
                "uyor"
            ],
            "meta_prefixes": [],
            "meta_suffixes": [
                "Hyor"
            ],
            "derivation": "vısunuyor",
            "reference": "vısunuyor",
            "sentence": "zaman için yaptığım bu öz fikirli tanımım, geçen zamanın başarılı olmadığı sürece kaybolacağını ___",
            "cot_answer": "To answer the question, we will first use the novel word's definition to derive an existing word in Turkish that has the same meaning and then replace the root in this derivation with the given novel root. Given novel root \"vısun\" is defined to mean \"savun\", so let's first try to derive a new word from \"savun\" using the given affixes. To construct a grammatically correct word in Turkish, we need to append the given affix to the root. The root given is \"savun\" and the affix is \"uyor\". \n\nThe correct construction would be to attach the affix directly to the root without any changes since the root ends in a vowel and the affix starts with a vowel, and in Turkish, this is a permissible combination.\n\nSo, the constructed word is \"savunuyor\".\n\nAffix used: uyor\n\nNow we replace the root \"savun\" in \"savunuyor\" with our novel root \"vısun\" to get the final answer \"vısunuyor\".\n\nFinal answer: <Answer>vısunuyor</Answer>",
            "id_root": "savun",
            "ood_root": "vısun",
            "id_derivation": "savunuyor",
            "answer_suffix": "\n\nNow we replace the root \"savun\" in \"savunuyor\" with our novel root \"vısun\" to get the final answer \"vısunuyor\".\n\nFinal answer: <Answer>vısunuyor</Answer>"
        },
        {
            "id": "tr-btwd-fc7d4dcf",
            "root": "doru",
            "prefixes": [],
            "suffixes": [
                "t",
                "muş"
            ],
            "meta_prefixes": [],
            "meta_suffixes": [
                "t",
                "mHş"
            ],
            "derivation": "dorutmuş",
            "reference": "dorutmuş",
            "sentence": "ona muhtaç olan en zararsızı bile, melek yavruları bile, düşünmeden ___ geçmiş",
            "cot_answer": "To answer the question, we will first use the novel word's definition to derive an existing word in Turkish that has the same meaning and then replace the root in this derivation with the given novel root. Given novel root \"doru\" is defined to mean \"kuru\", so let's first try to derive a new word from \"kuru\" using the given affixes. First, let's append the affixes to the root \"kuru\" in a grammatically correct order:\n\n1. \"t\" is a past tense marker for verbs, but \"kuru\" is an adjective meaning \"dry\". In Turkish, to convert an adjective to a verb, you often use the affix \"-(I)r\" or \"-(I)l\" (with vowel harmony). However, since we don't have such an affix in the list, we can assume that \"kuru\" is being used as a verb root here, meaning \"to dry\". So we can directly add \"t\" to indicate past tense: \"kurut\" (he/she/it dried).\n\n2. \"muş\" is a suffix that is used to indicate hearsay or uncertainty about the past. It should be attached after the verb root has been put into the past tense: \"kurutmuş\" (he/she/it has apparently dried).\n\nNow, let's put the word together:\n\n<kuru> + <t> + <muş> = <kurutmuş>\n\nLet's verify adherence to the rules:\n- No affix is used more than once.\n- All provided affixes are used.\n- No extra affixes outside the provided list are included.\n\nNow we replace the root \"kuru\" in \"kurutmuş\" with our novel root \"doru\" to get the final answer \"dorutmuş\".\n\nFinal answer: <Answer>dorutmuş</Answer>",
            "id_root": "kuru",
            "ood_root": "doru",
            "id_derivation": "kurutmuş",
            "answer_suffix": "\n\nNow we replace the root \"kuru\" in \"kurutmuş\" with our novel root \"doru\" to get the final answer \"dorutmuş\".\n\nFinal answer: <Answer>dorutmuş</Answer>"
        },
        {
            "id": "tr-btwd-436f2794",
            "root": "ledap",
            "prefixes": [],
            "suffixes": [
                "da",
                "çı"
            ],
            "meta_prefixes": [],
            "meta_suffixes": [
                "DA",
                "CH"
            ],
            "derivation": "ledapçıda",
            "reference": "ledapçıda",
            "sentence": "hafta sonu bir ___ öylesine gezinirken tam da bu karmaşayı çok güzel anlatan bir kitap geçti elime: amerikalı yazar brendan-john freely’den “galata, pera, beyoğlu”",
            "cot_answer": "To answer the question, we will first use the novel word's definition to derive an existing word in Turkish that has the same meaning and then replace the root in this derivation with the given novel root. Given novel root \"ledap\" is defined to mean \"kitap\", so let's first try to derive a new word from \"kitap\" using the given affixes. First, let's append the affixes to the root \"kitap\" one by one, following Turkish grammar rules.\n\n1. \"kitap\" + \"çı\" = \"kitapçı\" (meaning \"bookshop\" or \"bookseller\")\n2. \"kitapçı\" + \"da\" = \"kitapçıda\" (meaning \"in the bookshop\")\n\nNow, let's list each affix used in the construction of the word:\n\n- \"çı\" (suffix that turns a noun into a person or place associated with that noun)\n- \"da\" (locative case suffix, meaning \"in\" or \"at\")\n\nWe have used each affix exactly once, and we have not included any extra affixes.\n\nNow we replace the root \"kitap\" in \"kitapçıda\" with our novel root \"ledap\" to get the final answer \"ledapçıda\".\n\nFinal answer: <Answer>ledapçıda</Answer>",
            "id_root": "kitap",
            "ood_root": "ledap",
            "id_derivation": "kitapçıda",
            "answer_suffix": "\n\nNow we replace the root \"kitap\" in \"kitapçıda\" with our novel root \"ledap\" to get the final answer \"ledapçıda\".\n\nFinal answer: <Answer>ledapçıda</Answer>"
        },
        {
            "id": "tr-btwd-f8918537",
            "root": "yoyha",
            "prefixes": [],
            "suffixes": [
                "mış",
                "lan"
            ],
            "meta_prefixes": [],
            "meta_suffixes": [
                "mHş",
                "lAn"
            ],
            "derivation": "yoyhalanmış",
            "reference": "yoyhalanmış",
            "sentence": "i̇şçilerin karın tokluğuna bu fabrikalarda çalışmayı kabul etmesi de göçte insanların nasıl bir sefalet çektiğini ve sonucunda ise ellerinde avuçlarında kalanları, zaten ___ olan ailelerini daha da parçalanmaması için korumak uğruna kabul ettiklerini özetler niteliktedir",
            "cot_answer": "To answer the question, we will first use the novel word's definition to derive an existing word in Turkish that has the same meaning and then replace the root in this derivation with the given novel root. Given novel root \"yoyha\" is defined to mean \"parça\", so let's first try to derive a new word from \"parça\" using the given affixes. First, we will append the affix \"lan\" to the root \"parça\" to create a verb form that means \"to become fragmented\" or \"to be divided into pieces\". Then, we will add the affix \"mış\" to indicate past tense, third person singular in the indicative mood, which also implies an evidential or hearsay past.\n\nStep 1: parça + lan = parçalan (to become fragmented)\nStep 2: parçalan + mış = parçalanmış (has/had become fragmented, it is said to have become fragmented)\n\nAffixes used in order:\n1. lan\n2. mış\n\nAll provided affixes are used, no extra affixes are included, and each affix is used exactly once.\n\nNow we replace the root \"parça\" in \"parçalanmış\" with our novel root \"yoyha\" to get the final answer \"yoyhalanmış\".\n\nFinal answer: <Answer>yoyhalanmış</Answer>",
            "id_root": "parça",
            "ood_root": "yoyha",
            "id_derivation": "parçalanmış",
            "answer_suffix": "\n\nNow we replace the root \"parça\" in \"parçalanmış\" with our novel root \"yoyha\" to get the final answer \"yoyhalanmış\".\n\nFinal answer: <Answer>yoyhalanmış</Answer>"
        },
        {
            "id": "tr-btwd-d3ac0f45",
            "root": "latun",
            "prefixes": [],
            "suffixes": [
                "lar",
                "ım"
            ],
            "meta_prefixes": [],
            "meta_suffixes": [
                "lAr",
                "YHm"
            ],
            "derivation": "latunlarım",
            "reference": "latunlarım",
            "sentence": "kendimi toparlamaya ve bundan sonra ___ için üzülmeye değil, onları çözmek için çabalamaya karar verdim",
            "cot_answer": "To answer the question, we will first use the novel word's definition to derive an existing word in Turkish that has the same meaning and then replace the root in this derivation with the given novel root. Given novel root \"latun\" is defined to mean \"sorun\", so let's first try to derive a new word from \"sorun\" using the given affixes. First, we need to append the affixes to the root \"sorun\" in a grammatically correct order. In Turkish, the plural affix \"lar\" is added to a noun to make it plural, and the possessive affix \"ım\" is added to indicate possession (in this case, first person singular - \"my\").\n\nStep 1: Add the plural affix \"lar\" to the root \"sorun\" to make it plural.\nResult: sorunlar\n\nStep 2: Add the possessive affix \"ım\" to the pluralized noun to indicate possession.\nResult: sorunlarım\n\nNow, let's list each affix used in the construction of the word:\n1. lar (plural)\n2. ım (first person singular possessive)\n\nNow we replace the root \"sorun\" in \"sorunlarım\" with our novel root \"latun\" to get the final answer \"latunlarım\".\n\nFinal answer: <Answer>latunlarım</Answer>",
            "id_root": "sorun",
            "ood_root": "latun",
            "id_derivation": "sorunlarım",
            "answer_suffix": "\n\nNow we replace the root \"sorun\" in \"sorunlarım\" with our novel root \"latun\" to get the final answer \"latunlarım\".\n\nFinal answer: <Answer>latunlarım</Answer>"
        },
        {
            "id": "tr-btwd-e3364ec3",
            "root": "letühe",
            "prefixes": [],
            "suffixes": [
                "miş",
                "n"
            ],
            "meta_prefixes": [],
            "meta_suffixes": [
                "mHş",
                "Hn"
            ],
            "derivation": "letühenmiş",
            "reference": "letühenmiş",
            "sentence": "her ne kadar yazar eserinde bu durumu kesin bir yargı ile imkansız olarak ___ olsa da ben bu durumun kolay olmadığını kabul etsem de imkansız olduğu görüşüne kesinlikle katılmıyorum",
            "cot_answer": "To answer the question, we will first use the novel word's definition to derive an existing word in Turkish that has the same meaning and then replace the root in this derivation with the given novel root. Given novel root \"letühe\" is defined to mean \"nitele\", so let's first try to derive a new word from \"nitele\" using the given affixes. First, we need to append the affixes to the root \"nitele\" in a grammatically correct way in Turkish.\n\n1. The affix \"n\" is a passive voice marker for verbs in Turkish and is used after the root of the verb before tense or mood markers. So, we add \"n\" to \"nitele\" to get \"nitelen\".\n\n2. The affix \"miş\" is a past tense marker that indicates hearsay or uncertainty about the action. It is used after the verb root or after other affixes that modify the verb. So, we add \"miş\" after \"nitelen\" to get \"nitelenmiş\".\n\nNow, let's put the word together:\n\n<nitele> + <n> + <miş> = <nitelenmiş>\n\nLet's list each affix used in the construction of the word:\n\n1. n - passive voice marker\n2. miş - past tense hearsay marker\n\nWe have used each affix exactly once, all provided affixes are used, and no extra affixes are included.\n\nNow we replace the root \"nitele\" in \"nitelenmiş\" with our novel root \"letühe\" to get the final answer \"letühenmiş\".\n\nFinal answer: <Answer>letühenmiş</Answer>",
            "id_root": "nitele",
            "ood_root": "letühe",
            "id_derivation": "nitelenmiş",
            "answer_suffix": "\n\nNow we replace the root \"nitele\" in \"nitelenmiş\" with our novel root \"letühe\" to get the final answer \"letühenmiş\".\n\nFinal answer: <Answer>letühenmiş</Answer>"
        },
        {
            "id": "tr-btwd-09ffd45f",
            "root": "dotıf",
            "prefixes": [],
            "suffixes": [
                "lık",
                "ı",
                "lar"
            ],
            "meta_prefixes": [],
            "meta_suffixes": [
                "lHk",
                "YH",
                "lAr"
            ],
            "derivation": "dotıflıkları",
            "reference": "dotıflıkları",
            "sentence": "çünkü kanunun korumadığı bir birey haline gelmek söz konusudur ve yakalandığın takdirde en çok kadınlığının ___ kullanılarak muamele göreceğini bilirsin",
            "cot_answer": "To answer the question, we will first use the novel word's definition to derive an existing word in Turkish that has the same meaning and then replace the root in this derivation with the given novel root. Given novel root \"dotıf\" is defined to mean \"zayıf\", so let's first try to derive a new word from \"zayıf\" using the given affixes. First, let's append the affixes to the root \"zayıf\" in a grammatically correct order:\n\n1. \"lık\" is a noun-forming suffix that can be used to create a noun from an adjective. It often denotes a state or quality. So, we add \"lık\" to \"zayıf\" to form \"zayıflık\" which means \"weakness\".\n2. \"lar\" is a plural suffix. When added to \"zayıflık\", it pluralizes the noun, resulting in \"zayıflıklar\" which means \"weaknesses\".\n3. \"ı\" is a possessive suffix for the third person singular. It should be attached to a noun to indicate possession. In this case, we add \"ı\" to \"zayıflıklar\" to form \"zayıflıkları\" which means \"his/her/its weaknesses\".\n\nNow, let's list each affix used in the construction of the word:\n\n- \"lık\" to form \"zayıflık\"\n- \"lar\" to form \"zayıflıklar\"\n- \"ı\" to form \"zayıflıkları\"\n\nWe have used each affix exactly once, all provided affixes are used, and no extra affixes are included.\n\nNow we replace the root \"zayıf\" in \"zayıflıkları\" with our novel root \"dotıf\" to get the final answer \"dotıflıkları\".\n\nFinal answer: <Answer>dotıflıkları</Answer>",
            "id_root": "zayıf",
            "ood_root": "dotıf",
            "id_derivation": "zayıflıkları",
            "answer_suffix": "\n\nNow we replace the root \"zayıf\" in \"zayıflıkları\" with our novel root \"dotıf\" to get the final answer \"dotıflıkları\".\n\nFinal answer: <Answer>dotıflıkları</Answer>"
        },
        {
            "id": "tr-btwd-ddd278a7",
            "root": "arun",
            "prefixes": [],
            "suffixes": [
                "luğ",
                "a",
                "un"
            ],
            "meta_prefixes": [],
            "meta_suffixes": [
                "lHk",
                "YA",
                "Hn"
            ],
            "derivation": "arunluğuna",
            "reference": "arunluğuna",
            "sentence": "yaşamın ___ ve dışarıdan bakıldığındaki güzelliğine; yaşamdaki kısa süreli aşk, heyecan, mutluluk gibi duygulara aldanır insanlar",
            "cot_answer": "To answer the question, we will first use the novel word's definition to derive an existing word in Turkish that has the same meaning and then replace the root in this derivation with the given novel root. Given novel root \"arun\" is defined to mean \"uzun\", so let's first try to derive a new word from \"uzun\" using the given affixes. To construct a grammatically correct word in Turkish, we need to append the affixes to the root \"uzun\" in a way that makes sense in Turkish morphology. The order of affixes is important in Turkish, as it can change the meaning of the word. Let's go through the affixes one by one:\n\n1. \"luğ\" is a nominalizing suffix that can turn adjectives or nouns into abstract nouns.\n2. \"a\" is a dative case suffix, indicating direction towards something or someone.\n3. \"un\" is a possessive suffix for third person singular (his/her/its).\n\nNow, let's construct the word:\n\n1. Start with the root \"uzun\" (which means \"long\").\n2. Add the suffix \"luğ\" to create \"uzunluk\" (meaning \"length\").\n3. Add the suffix \"a\" to form \"uzunluğa\" (meaning \"to the length\").\n4. Finally, add the suffix \"un\" to get \"uzunluğuna\" (meaning \"to his/her/its length\").\n\nEach affix is used exactly once, and no extra affixes are included.\n\nNow we replace the root \"uzun\" in \"uzunluğuna\" with our novel root \"arun\" to get the final answer \"arunluğuna\".\n\nFinal answer: <Answer>arunluğuna</Answer>",
            "id_root": "uzun",
            "ood_root": "arun",
            "id_derivation": "uzunluğuna",
            "answer_suffix": "\n\nNow we replace the root \"uzun\" in \"uzunluğuna\" with our novel root \"arun\" to get the final answer \"arunluğuna\".\n\nFinal answer: <Answer>arunluğuna</Answer>"
        },
        {
            "id": "tr-btwd-b4360724",
            "root": "kıkın",
            "prefixes": [],
            "suffixes": [
                "laş",
                "tık",
                "ça"
            ],
            "meta_prefixes": [],
            "meta_suffixes": [
                "lAş",
                "DHk",
                "NCA"
            ],
            "derivation": "kıkınlaştıkça",
            "reference": "kıkınlaştıkça",
            "sentence": "bana büyülü gelen o diyarlar ___ sadece bir seraptan ibaret olduğunu gözler önüne seriyor",
            "cot_answer": "To answer the question, we will first use the novel word's definition to derive an existing word in Turkish that has the same meaning and then replace the root in this derivation with the given novel root. Given novel root \"kıkın\" is defined to mean \"yakın\", so let's first try to derive a new word from \"yakın\" using the given affixes. First, let's append the affixes to the root \"yakın\" in a grammatically correct order:\n\n1. yakın + laş = yakınlaş (to become close)\n2. yakınlaş + tık = yakınlaştık (we became close)\n3. yakınlaştık + ça = yakınlaştıkça (as we become close)\n\nNow, let's list each affix used in the construction of the word:\n\n1. laş\n2. tık\n3. ça\n\nWe have used each affix exactly once, and we have not included any extra affixes outside the provided list.\n\nNow we replace the root \"yakın\" in \"yakınlaştıkça\" with our novel root \"kıkın\" to get the final answer \"kıkınlaştıkça\".\n\nFinal answer: <Answer>kıkınlaştıkça</Answer>",
            "id_root": "yakın",
            "ood_root": "kıkın",
            "id_derivation": "yakınlaştıkça",
            "answer_suffix": "\n\nNow we replace the root \"yakın\" in \"yakınlaştıkça\" with our novel root \"kıkın\" to get the final answer \"kıkınlaştıkça\".\n\nFinal answer: <Answer>kıkınlaştıkça</Answer>"
        },
        {
            "id": "tr-btwd-8a8f5503",
            "root": "nebü",
            "prefixes": [],
            "suffixes": [
                "çesine",
                "miş",
                "len"
            ],
            "meta_prefixes": [],
            "meta_suffixes": [
                "CAsHnA",
                "mHş",
                "lAn"
            ],
            "derivation": "nebülenmişçesine",
            "reference": "nebülenmişçesine",
            "sentence": "bir gün yolunuz madrid’deki prado müzesine düşerse yaşayabileceğiniz en güzel deneyim şüphesiz “the garden of earthly delights”a ,hieronymus bosch, ___ kendinizi kaptırdığınız dakikalar olacaktır",
            "cot_answer": "To answer the question, we will first use the novel word's definition to derive an existing word in Turkish that has the same meaning and then replace the root in this derivation with the given novel root. Given novel root \"nebü\" is defined to mean \"büyü\", so let's first try to derive a new word from \"büyü\" using the given affixes. First, let's append the affixes to the root \"büyü\" in a grammatically correct order:\n\n1. \"len\" is a passive or reflexive suffix that can be added directly to the root to make it an adjective or to give a meaning that the action is done to the subject itself. So we get \"büyülen\".\n\n2. \"miş\" is a suffix used to indicate hearsay or past experience that the speaker did not directly witness. It is often used after a verb, so we can add it to \"büyülen\" to create a verb in the past tense that implies hearsay. We get \"büyülenmiş\".\n\n3. \"çesine\" is a suffix that is used to indicate a manner or way of doing something, similar to the English \"-like\" or \"-as if\". It is added to the end of the word. So we add it to \"büyülenmiş\" to get \"büyülenmişçesine\".\n\nNow, let's put it all together:\n\nRoot: büyü\nAffixes: len, miş, çesine\nConstructed word: büyülenmişçesine\n\nTo verify adherence to the rules:\n- Each affix is used exactly once.\n- All provided affixes are used.\n- No extra affixes are included.\n\nNow we replace the root \"büyü\" in \"büyülenmişçesine\" with our novel root \"nebü\" to get the final answer \"nebülenmişçesine\".\n\nFinal answer: <Answer>nebülenmişçesine</Answer>",
            "id_root": "büyü",
            "ood_root": "nebü",
            "id_derivation": "büyülenmişçesine",
            "answer_suffix": "\n\nNow we replace the root \"büyü\" in \"büyülenmişçesine\" with our novel root \"nebü\" to get the final answer \"nebülenmişçesine\".\n\nFinal answer: <Answer>nebülenmişçesine</Answer>"
        },
        {
            "id": "tr-btwd-8f314d37",
            "root": "mıymet",
            "prefixes": [],
            "suffixes": [
                "me",
                "se",
                "k"
            ],
            "meta_prefixes": [],
            "meta_suffixes": [
                "mA",
                "sA",
                "k"
            ],
            "derivation": "mıymetmekse",
            "reference": "mıymetmekse",
            "cot_answer": "To answer the question, we will first use the novel word's definition to derive an existing word in Turkish that has the same meaning and then replace the root in this derivation with the given novel root. Given novel root \"mıymet\" is defined to mean \"farket\", so let's first try to derive a new word from \"farket\" using the given affixes. First, let's analyze the affixes and the root given:\n\nRoot: farket\nAffixes: me, se, k\n\nIn Turkish, the affix \"me\" is a negation suffix for verbs, \"se\" is a conditional suffix, and \"k\" is a past tense suffix for verbs in the narrative (rarely used) or as a necessity mood marker.\n\nThe correct order for these affixes would be:\n1. \"me\" to negate the verb,\n2. \"se\" to turn it into a conditional mood,\n3. \"k\" to indicate past tense or necessity.\n\nSo, the constructed word would be \"farketmese\" (if it had not been noticed), but since we have the \"k\" affix, which doesn't fit well after \"se\" in this context, we might need to reconsider the order or the use of \"k\". The \"k\" suffix is not commonly used in modern Turkish and might be a typo or a mistake. If we ignore the \"k\" and just use \"me\" and \"se\", we get \"farketmese\" which is a grammatically correct word.\n\nHowever, if we are to use all affixes, the \"k\" would typically come before \"se\" to form a word that is grammatically correct but not commonly used in modern Turkish. The word would be \"farketmekse\" (if it is to be noticed/noticed), but this construction is highly unusual and not standard.\n\nGiven the constraints and the goal of using all affixes once.\n\nNow we replace the root \"farket\" in \"farketmekse\" with our novel root \"mıymet\" to get the final answer \"mıymetmekse\".\n\nFinal answer: <Answer>mıymetmekse</Answer>",
            "id_root": "farket",
            "ood_root": "mıymet",
            "id_derivation": "farketmekse",
            "answer_suffix": "\n\nNow we replace the root \"farket\" in \"farketmekse\" with our novel root \"mıymet\" to get the final answer \"mıymetmekse\".\n\nFinal answer: <Answer>mıymetmekse</Answer>"
        },
        {
            "id": "tr-btwd-268cd45d",
            "root": "yabufa",
            "prefixes": [],
            "suffixes": [
                "diğ",
                "yabil",
                "im",
                "iz"
            ],
            "meta_prefixes": [],
            "meta_suffixes": [
                "DHk",
                "YAbil",
                "Hm",
                "YHz"
            ],
            "derivation": "yabufayabildiğimiz",
            "reference": "yabufayabildiğimiz",
            "sentence": "belki de mutluluk sadece ___ bir ģeydir, belki de onu asla yakalayamayacağız",
            "cot_answer": "To answer the question, we will first use the novel word's definition to derive an existing word in Turkish that has the same meaning and then replace the root in this derivation with the given novel root. Given novel root \"yabufa\" is defined to mean \"kovala\", so let's first try to derive a new word from \"kovala\" using the given affixes. To construct a grammatically correct word in Turkish, we need to follow the rules of Turkish morphology and syntax. We will append the affixes to the root \"kovala\" in a logical order to create a meaningful word.\n\n1. \"diğ\" is a relative suffix that turns a verb into an adjective or a noun.\n2. \"yabil\" is a potential mood suffix that indicates the ability to do the action of the verb.\n3. \"im\" is a possessive suffix for the first person singular.\n4. \"iz\" is a plural suffix for the first person.\n\nThe correct order for these affixes would be to first turn the verb into a potential mood, then make it into a noun with the relative suffix, and finally add the possessive and plural suffixes.\n\nSo, the construction would be as follows:\n- kovala (root) + yabil (potential mood) = kovalayabil\n- kovalayabil + diğ (relative suffix) = kovalayabildiğ\n- kovalayabildiğ + im (first person singular possessive) = kovalayabildiğim\n- kovalayabildiğim + iz (first person plural) = kovalayabildiğimiz\n\nAll affixes are used exactly once, and no extra affixes are included.\n\nNow we replace the root \"kovala\" in \"kovalayabildiğimiz\" with our novel root \"yabufa\" to get the final answer \"yabufayabildiğimiz\".\n\nFinal answer: <Answer>yabufayabildiğimiz</Answer>",
            "id_root": "kovala",
            "ood_root": "yabufa",
            "id_derivation": "kovalayabildiğimiz",
            "answer_suffix": "\n\nNow we replace the root \"kovala\" in \"kovalayabildiğimiz\" with our novel root \"yabufa\" to get the final answer \"yabufayabildiğimiz\".\n\nFinal answer: <Answer>yabufayabildiğimiz</Answer>"
        },
        {
            "id": "tr-btwd-0a269bdd",
            "root": "yübek",
            "prefixes": [],
            "suffixes": [
                "in",
                "lik",
                "ler",
                "de"
            ],
            "meta_prefixes": [],
            "meta_suffixes": [
                "Hn",
                "lHk",
                "lAr",
                "NDA"
            ],
            "derivation": "yübekliklerinde",
            "reference": "yübekliklerinde",
            "sentence": "i̇nsanlar, ___ zorla yemek yemek, uyumak zorunda kalırlar",
            "cot_answer": "To answer the question, we will first use the novel word's definition to derive an existing word in Turkish that has the same meaning and then replace the root in this derivation with the given novel root. Given novel root \"yübek\" is defined to mean \"bebek\", so let's first try to derive a new word from \"bebek\" using the given affixes. First, let's analyze the affixes and their functions in Turkish:\n\n- \"in\" is a possessive suffix for the third person singular (his/her/its).\n- \"lik\" is a suffix that can turn a noun into another noun, often indicating a state, condition, or quality.\n- \"ler\" is a plural suffix for nouns.\n- \"de\" is a locative suffix indicating the location (on, at, in).\n\nNow, let's construct the word step by step:\n\n1. Start with the root: bebek (baby)\n2. Add \"lik\" to form a noun that indicates a state or quality: bebeklik (childhood)\n3. Add \"ler\" to pluralize: bebeklikler (childhoods)\n4. Add \"in\" to indicate possession: bebekliklerin (of the childhoods)\n5. Add \"de\" to indicate location: bebekliklerinde (in the childhoods)\n\nAll provided affixes are used exactly once, and no extra affixes are included.\n\nNow we replace the root \"bebek\" in \"bebekliklerinde\" with our novel root \"yübek\" to get the final answer \"yübekliklerinde\".\n\nFinal answer: <Answer>yübekliklerinde</Answer>",
            "id_root": "bebek",
            "ood_root": "yübek",
            "id_derivation": "bebekliklerinde",
            "answer_suffix": "\n\nNow we replace the root \"bebek\" in \"bebekliklerinde\" with our novel root \"yübek\" to get the final answer \"yübekliklerinde\".\n\nFinal answer: <Answer>yübekliklerinde</Answer>"
        },
        {
            "id": "tr-btwd-6d8cb821",
            "root": "yarun",
            "prefixes": [],
            "suffixes": [
                "ma",
                "ma",
                "sı",
                "na"
            ],
            "meta_prefixes": [],
            "meta_suffixes": [
                "mA",
                "mA",
                "sH",
                "NA"
            ],
            "derivation": "yarunmamasına",
            "reference": "yarunmamasına",
            "sentence": "yazı yazmak ile koşmak arasında neredeyse hiçbir ilişki ___ rağmen, bir yazar bile koşmanın mesleğine birçok katkısı olduğunu savunuyorsa, bu eylemin insana gerçekten büyük katkılarda bulunabileceği göz önünde bulundurulmalıdır",
            "cot_answer": "To answer the question, we will first use the novel word's definition to derive an existing word in Turkish that has the same meaning and then replace the root in this derivation with the given novel root. Given novel root \"yarun\" is defined to mean \"bulun\", so let's first try to derive a new word from \"bulun\" using the given affixes. To construct a grammatically correct word in Turkish, we need to follow the rules of Turkish morphology and syntax. We have the root \"bulun\" and the affixes \"ma, ma, sı, na\". Since we have two \"ma\" affixes, we need to be careful about their placement and function in the word.\n\n1. The first \"ma\" is likely a negation suffix for verbs.\n2. The second \"ma\" could be a nominalization suffix, turning the verb into a noun.\n3. The \"sı\" is a possessive suffix (3rd person singular).\n4. The \"na\" is a dative case suffix.\n\nLet's construct the word step by step:\n\n1. \"bulun\" + \"ma\" (negation) = \"bulunma\" (not to be found)\n2. \"bulunma\" + \"sı\" (possessive) = \"bulunması\" (his/her/its not being found)\n3. \"bulunması\" + \"na\" (dative) = \"bulunmasına\" (to his/her/its not being found)\n\nHowever, we still have one \"ma\" left, which is a nominalization suffix. We need to use it to turn the verb into a noun before we can add the possessive and dative suffixes:\n\n1. \"bulun\" + \"ma\" (nominalization) = \"bulunma\" (the act of finding)\n2. \"bulunma\" + \"sı\" (possessive) = \"bulunması\" (his/her/its finding)\n3. \"bulunması\" + \"na\" (dative) = \"bulunmasına\" (to his/her/its finding)\n4. \"bulunmasına\" + \"ma\" (negation) = \"bulunmamasına\" (to his/her/its not finding)\n\nNow we have used all the affixes correctly and constructed a grammatically correct word in Turkish.\n\nNow we replace the root \"bulun\" in \"bulunmamasına\" with our novel root \"yarun\" to get the final answer \"yarunmamasına\".\n\nFinal answer: <Answer>yarunmamasına</Answer>",
            "id_root": "bulun",
            "ood_root": "yarun",
            "id_derivation": "bulunmamasına",
            "answer_suffix": "\n\nNow we replace the root \"bulun\" in \"bulunmamasına\" with our novel root \"yarun\" to get the final answer \"yarunmamasına\".\n\nFinal answer: <Answer>yarunmamasına</Answer>"
        },
        {
            "id": "tr-btwd-244022ab",
            "root": "mırdı",
            "prefixes": [],
            "suffixes": [
                "ki",
                "lar",
                "da",
                "ın"
            ],
            "meta_prefixes": [],
            "meta_suffixes": [
                "ki",
                "lAr",
                "NDA",
                "Hn"
            ],
            "derivation": "mırdılarındaki",
            "reference": "mırdılarındaki",
            "sentence": "ziggy’nin, binbaşı tom’un, kısaca bowie ___ tüm karakterlerin uzay gemisini terk etme ve o garip, sonsuz boşluğa açılma zamanı gelmişti artık",
            "cot_answer": "To answer the question, we will first use the novel word's definition to derive an existing word in Turkish that has the same meaning and then replace the root in this derivation with the given novel root. Given novel root \"mırdı\" is defined to mean \"şarkı\", so let's first try to derive a new word from \"şarkı\" using the given affixes. To construct a grammatically correct word in Turkish, we need to follow the rules of Turkish morphology and syntax. We will append the affixes to the root \"şarkı\" in a way that makes sense in Turkish.\n\n1. \"şarkı\" is the root word meaning \"song\".\n2. \"lar\" is a plural suffix.\n3. \"ın\" is a possessive suffix (3rd person singular \"his/her/its\").\n4. \"da\" is a locative suffix (meaning \"in/at\").\n5. \"ki\" is a suffix that is used to form an adjective from a noun phrase.\n\nThe correct order for the affixes would be:\n\n1. \"şarkı\" + \"lar\" = \"şarkılar\" (songs)\n2. \"şarkılar\" + \"ın\" = \"şarkıların\" (of the songs)\n3. \"şarkıların\" + \"da\" = \"şarkılarında\" (in their songs)\n4. \"şarkılarında\" + \"ki\" = \"şarkılarındaki\" (the ones in their songs)\n\nSo the final word is \"şarkılarındaki\". All affixes are used exactly once, and no extra affixes are included. \n\nNow we replace the root \"şarkı\" in \"şarkılarındaki\" with our novel root \"mırdı\" to get the final answer \"mırdılarındaki\".\n\nFinal answer: <Answer>mırdılarındaki</Answer>",
            "id_root": "şarkı",
            "ood_root": "mırdı",
            "id_derivation": "şarkılarındaki",
            "answer_suffix": "\n\nNow we replace the root \"şarkı\" in \"şarkılarındaki\" with our novel root \"mırdı\" to get the final answer \"mırdılarındaki\".\n\nFinal answer: <Answer>mırdılarındaki</Answer>"
        },
        {
            "id": "tr-btwd-362aa1b3",
            "root": "lavay",
            "prefixes": [],
            "suffixes": [
                "laş",
                "ma",
                "tır",
                "sa"
            ],
            "meta_prefixes": [],
            "meta_suffixes": [
                "lAş",
                "mA",
                "DHr",
                "sA"
            ],
            "derivation": "lavaylaştırmasa",
            "reference": "lavaylaştırmasa",
            "sentence": "örneğin bir ürün: yıllardır yapması çok üzün süren bir işi kısa sürede yapmamızı sağlayacak, ya da insanların hayatını ___ bile onları günlük stresten uzaklaştırıp eğlendirecek bir ürün",
            "cot_answer": "To answer the question, we will first use the novel word's definition to derive an existing word in Turkish that has the same meaning and then replace the root in this derivation with the given novel root. Given novel root \"lavay\" is defined to mean \"kolay\", so let's first try to derive a new word from \"kolay\" using the given affixes. First, let's analyze the affixes and the order in which they should be appended to the root \"kolay\" to form a grammatically correct word in Turkish.\n\n1. \"laş\" - This is a derivational suffix that can be used to form an adjective or verb, often indicating becoming or getting to be in the state of the root.\n2. \"ma\" - This is a negation suffix that is often used to form the negative of verbs.\n3. \"tır\" - This is a causative suffix that can be used to form verbs that mean to make or cause to do something.\n4. \"sa\" - This is a conditional suffix that is used to form the conditional mood of verbs.\n\nThe correct order to append these affixes to the root \"kolay\" would be:\n\n1. kolay + laş = kolaylaş (to become easy)\n2. kolaylaş + tır = kolaylaştır (to make something become easy)\n3. kolaylaştır + ma = kolaylaştırma (to not make something become easy)\n4. kolaylaştırma + sa = kolaylaştırmasa (if [he/she/it] does not make something become easy)\n\nSo the final word is \"kolaylaştırmasa\".\n\nAll affixes are used exactly once, no extra affixes are included, and the final word is grammatically correct in Turkish.\n\nNow we replace the root \"kolay\" in \"kolaylaştırmasa\" with our novel root \"lavay\" to get the final answer \"lavaylaştırmasa\".\n\nFinal answer: <Answer>lavaylaştırmasa</Answer>",
            "id_root": "kolay",
            "ood_root": "lavay",
            "id_derivation": "kolaylaştırmasa",
            "answer_suffix": "\n\nNow we replace the root \"kolay\" in \"kolaylaştırmasa\" with our novel root \"lavay\" to get the final answer \"lavaylaştırmasa\".\n\nFinal answer: <Answer>lavaylaştırmasa</Answer>"
        },
        {
            "id": "tr-btwd-ffe2cc1e",
            "root": "ruygam",
            "prefixes": [],
            "suffixes": [
                "tır",
                "sal",
                "ya",
                "laş",
                "ma"
            ],
            "meta_prefixes": [],
            "meta_suffixes": [
                "DHr",
                "sAl",
                "YA",
                "lAş",
                "mA"
            ],
            "derivation": "ruygamsallaştırmaya",
            "reference": "ruygamsallaştırmaya",
            "sentence": "bu bağlamda sonuç olarak diyebilirim ki halihazırda ___ çalıştığım fazlalıklardan kurtulma meselesine dair taze bakış açıları kazandırması nedeniyle kondo'nun eserini büyük bir keyifle okudum",
            "cot_answer": "To answer the question, we will first use the novel word's definition to derive an existing word in Turkish that has the same meaning and then replace the root in this derivation with the given novel root. Given novel root \"ruygam\" is defined to mean \"kavram\", so let's first try to derive a new word from \"kavram\" using the given affixes. To construct a grammatically correct word in Turkish, we need to follow the rules of Turkish morphology and syntax. We will append the affixes to the root \"kavram\" in a logical order to create a meaningful word.\n\n1. \"kavram\" (concept) is the root.\n2. \"sal\" is a suffix that turns a noun into an adjective (related to).\n3. \"laş\" is a suffix that indicates becoming or getting to be.\n4. \"tır\" is a causative suffix.\n5. \"ma\" is a nominalization suffix that turns a verb into a noun.\n6. \"ya\" is a dative case suffix.\n\nNow, let's construct the word:\n\n1. kavram + sal = kavramsal (conceptual)\n2. kavramsal + laş = kavramsallaş (become conceptual)\n3. kavramsallaş + tır = kavramsallaştır (to make conceptual)\n4. kavramsallaştır + ma = kavramsallaştırma (the act of making conceptual)\n5. kavramsallaştırma + ya = kavramsallaştırmaya (to the act of making conceptual)\n\nThe final word is \"kavramsallaştırmaya\".\n\nAll affixes have been used exactly once, and no extra affixes have been included.\n\nNow we replace the root \"kavram\" in \"kavramsallaştırmaya\" with our novel root \"ruygam\" to get the final answer \"ruygamsallaştırmaya\".\n\nFinal answer: <Answer>ruygamsallaştırmaya</Answer>",
            "id_root": "kavram",
            "ood_root": "ruygam",
            "id_derivation": "kavramsallaştırmaya",
            "answer_suffix": "\n\nNow we replace the root \"kavram\" in \"kavramsallaştırmaya\" with our novel root \"ruygam\" to get the final answer \"ruygamsallaştırmaya\".\n\nFinal answer: <Answer>ruygamsallaştırmaya</Answer>"
        },
        {
            "id": "tr-btwd-fb32a351",
            "root": "risin",
            "prefixes": [],
            "suffixes": [
                "in",
                "tir",
                "iz",
                "leş",
                "diğ"
            ],
            "meta_prefixes": [],
            "meta_suffixes": [
                "Hn",
                "DHr",
                "YHz",
                "lAş",
                "DHk"
            ],
            "derivation": "risinleştirdiğiniz",
            "reference": "risinleştirdiğiniz",
            "sentence": "bir aşk düşünün ya da bir tutku kelimelerle dibini kazıp ___ sonra da içini dolduramadığınız",
            "cot_answer": "To answer the question, we will first use the novel word's definition to derive an existing word in Turkish that has the same meaning and then replace the root in this derivation with the given novel root. Given novel root \"risin\" is defined to mean \"derin\", so let's first try to derive a new word from \"derin\" using the given affixes. To construct a grammatically correct word in Turkish, we need to follow the rules of Turkish morphology and syntax. We will append the affixes to the root \"derin\" in a way that makes sense in Turkish.\n\n1. \"derin\" (deep)\n2. \"derin\" + \"leş\" = \"derinleş\" (to become deep)\n3. \"derinleş\" + \"tir\" = \"derinleştir\" (to make something become deep)\n4. \"derinleştir\" + \"diğ\" = \"derinleştirdiğ\" (that which has made something become deep - a participle form)\n5. \"derinleştirdiğ\" + \"in\" = \"derinleştirdiğin\" (that which you have made become deep - second person singular possessive)\n6. \"derinleştirdiğin\" + \"iz\" = \"derinleştirdiğiniz\" (that which you (plural/formal) have made become deep - second person plural possessive)\n\nThe final word is \"derinleştirdiğiniz,\" and it means \"that which you (plural/formal) have made become deep.\"\n\nAffixes used in order:\n- leş\n- tir\n- diğ\n- in\n- iz.\n\nNow we replace the root \"derin\" in \"derinleştirdiğiniz\" with our novel root \"risin\" to get the final answer \"risinleştirdiğiniz\".\n\nFinal answer: <Answer>risinleştirdiğiniz</Answer>",
            "id_root": "derin",
            "ood_root": "risin",
            "id_derivation": "derinleştirdiğiniz",
            "answer_suffix": "\n\nNow we replace the root \"derin\" in \"derinleştirdiğiniz\" with our novel root \"risin\" to get the final answer \"risinleştirdiğiniz\".\n\nFinal answer: <Answer>risinleştirdiğiniz</Answer>"
        },
        {
            "id": "tr-btwd-ec2ffaf7",
            "root": "nıbıt",
            "prefixes": [],
            "suffixes": [
                "lar",
                "den",
                "da",
                "ki",
                "ler"
            ],
            "meta_prefixes": [],
            "meta_suffixes": [
                "lAr",
                "NDAn",
                "DA",
                "ki",
                "lAr"
            ],
            "derivation": "nıbıtlardakilerden",
            "reference": "nıbıtlardakilerden",
            "sentence": "hemen belirtmeliyim ki bunlar içlerinden çıkıp geldikleri o ___ farklı bir konuma gelmişlerdir",
            "cot_answer": "To answer the question, we will first use the novel word's definition to derive an existing word in Turkish that has the same meaning and then replace the root in this derivation with the given novel root. Given novel root \"nıbıt\" is defined to mean \"yapıt\", so let's first try to derive a new word from \"yapıt\" using the given affixes. To construct a grammatically correct word in Turkish, we need to follow the rules of Turkish morphology and syntax. The affixes provided need to be appended in a way that makes sense in Turkish grammar. Let's go through the affixes one by one:\n\n1. \"ler\" or \"lar\" - Plural suffix, used to pluralize nouns or adjectives. It must agree in vowel harmony with the word root.\n2. \"den\" - Ablative case suffix, indicating \"from\" or \"than\" something.\n3. \"da\" - Locative case suffix, indicating \"in\" or \"at\" something.\n4. \"ki\" - A suffix that forms an adjective from a noun or pronoun, often equivalent to the English \"that\" or \"which.\"\n\nGiven the word root \"yapıt\" (which means \"work\" or \"piece of art\"), we need to determine the correct order of affixes. The correct order should be:\n\n1. \"yapıt\" (root)\n2. \"lar\" (plural suffix, because \"yapıt\" ends with a back vowel, we use \"lar\" instead of \"ler\" for vowel harmony)\n3. \"da\" (locative case suffix, to be used after pluralizing the noun)\n4. \"ki\" (adjective-forming suffix, which should come after the case suffix)\n5. \"den\" (ablative case suffix, which should be the last one as it indicates \"from\" the previously described location)\n\nSo, the constructed word is \"yapıtlardakilerden\".\n\nLet's list each affix used in the construction of that word:\n- \"lar\" (plural suffix)\n- \"da\" (locative case suffix)\n- \"ki\" (adjective-forming suffix)\n- \"den\" (ablative case suffix)\n\nWe have used each affix exactly once, and we have not used any extra affixes outside the provided list.\n\nNow we replace the root \"yapıt\" in \"yapıtlardakilerden\" with our novel root \"nıbıt\" to get the final answer \"nıbıtlardakilerden\".\n\nFinal answer: <Answer>nıbıtlardakilerden</Answer>",
            "id_root": "yapıt",
            "ood_root": "nıbıt",
            "id_derivation": "yapıtlardakilerden",
            "answer_suffix": "\n\nNow we replace the root \"yapıt\" in \"yapıtlardakilerden\" with our novel root \"nıbıt\" to get the final answer \"nıbıtlardakilerden\".\n\nFinal answer: <Answer>nıbıtlardakilerden</Answer>"
        },
        {
            "id": "tr-btwd-d89876e3",
            "root": "rusvak",
            "prefixes": [],
            "suffixes": [
                "dır",
                "mak",
                "lan",
                "ma",
                "ta"
            ],
            "meta_prefixes": [],
            "meta_suffixes": [
                "DHr",
                "mAk",
                "lAn",
                "mA",
                "DA"
            ],
            "derivation": "rusvaklanmamaktadır",
            "reference": "rusvaklanmamaktadır",
            "sentence": "açıkça görülmektedir ki arkadaş olmaları ortak ilgi alanlarından ve zevklerinden ___",
            "cot_answer": "To answer the question, we will first use the novel word's definition to derive an existing word in Turkish that has the same meaning and then replace the root in this derivation with the given novel root. Given novel root \"rusvak\" is defined to mean \"kaynak\", so let's first try to derive a new word from \"kaynak\" using the given affixes. To construct a grammatically correct word in Turkish, we need to follow the correct order of affixes. The root word is \"kaynak,\" and the affixes are \"dır,\" \"mak,\" \"lan,\" \"ma,\" \"ta.\" \n\nFirst, we need to identify the type of affixes we have:\n- \"mak\" is a verbal infinitive marker.\n- \"lan\" is a reflexive/passive voice marker for verbs.\n- \"ma\" is a negation marker for verbs.\n- \"ta\" is a locative case marker for nouns.\n- \"dır\" is a verbal/nominal predicate marker for certainty/definiteness.\n\nThe correct order for affixes when constructing a verb would be to first turn the noun into a verb, then apply reflexivity/passivity if needed, followed by negation, and then the infinitive if we are creating a verb to be used as a noun or another part of speech. Then we can add the locative case and the predicate marker.\n\nSo, the correct order of affixes to form a verb from \"kaynak\" would be:\n1. \"lan\" to make it reflexive/passive.\n2. \"ma\" to negate it.\n3. \"mak\" to put it into the infinitive form.\n4. \"ta\" to indicate the state.\n5.\"dır\" to indicate the certainty.\n\nThe constructed word is \"kaynaklanmamaktadır,\" which means \"it is not in the state of not to originate from/be sourced from.\"\n\nNow we replace the root \"kaynak\" in \"kaynaklanmamaktadır\" with our novel root \"rusvak\" to get the final answer \"rusvaklanmamaktadır\".\n\nFinal answer: <Answer>rusvaklanmamaktadır</Answer>",
            "id_root": "kaynak",
            "ood_root": "rusvak",
            "id_derivation": "kaynaklanmamaktadır",
            "answer_suffix": "\n\nNow we replace the root \"kaynak\" in \"kaynaklanmamaktadır\" with our novel root \"rusvak\" to get the final answer \"rusvaklanmamaktadır\".\n\nFinal answer: <Answer>rusvaklanmamaktadır</Answer>"
        },
        {
            "id": "tr-btwd-ec63c008",
            "root": "dondı",
            "prefixes": [],
            "suffixes": [
                "abil",
                "eceğ",
                "im",
                "iz",
                "laş"
            ],
            "meta_prefixes": [],
            "meta_suffixes": [
                "YAbil",
                "YAcAk",
                "Hm",
                "YHz",
                "lAş"
            ],
            "derivation": "dondılaşabileceğimiz",
            "reference": "dondılaşabileceğimiz",
            "sentence": "yayımlanmasının üzerinden 62 yıl geçmiş olmasına rağmen hala içinde günümüz gerçekleriyle ___ roman, kahramanı murtaza üzerinden toplum eleştirisi yapan orhan kemal’in nadide bir eseridir",
            "cot_answer": "To answer the question, we will first use the novel word's definition to derive an existing word in Turkish that has the same meaning and then replace the root in this derivation with the given novel root. Given novel root \"dondı\" is defined to mean \"karşı\", so let's first try to derive a new word from \"karşı\" using the given affixes. First, let's analyze the affixes and their functions:\n\n- \"abil\" is a potential mood suffix that can be attached to verbs to indicate the ability to perform the action of the verb.\n- \"eceğ\" is a future tense suffix for verbs.\n- \"im\" is a first-person singular possessive or agreement suffix.\n- \"iz\" is a first-person plural possessive or agreement suffix.\n- \"laş\" is a reciprocal or reflexive verb-forming suffix.\n\nNow, let's construct the word step by step:\n\n1. The root \"karşı\" can function as a noun or an adjective. To use the affixes correctly, we need to turn it into a verb first. We can do this by adding the reflexive/reciprocal suffix \"laş\" to form \"karşılaş,\" which means \"to meet\" or \"to encounter.\"\n\n2. Next, we can add the potential mood suffix \"abil\" to indicate the ability to perform the action of the verb. This gives us \"karşılaşabil,\" meaning \"can meet\" or \"can encounter.\"\n\n3. Now, we can add the future tense suffix \"eceğ\" to indicate a future action. This results in \"karşılaşabileceğ,\" meaning \"will be able to meet\" or \"will be able to encounter.\"\n\n4. Finally, we need to add the \"im\" and \"iz\" suffixes. Since \"im\" is for first-person singular and \"iz\" is for first-person plural, we need to add \"im\" and then \"iz\". Then this gives us \"karşılaşabileceğimiz,\" meaning \"We will be able to meet\" or \"We will be able to encounter.\"\n\nAll provided affixes are used, no extra affixes are included, and each affix is used exactly once.\n\nNow we replace the root \"karşı\" in \"karşılaşabileceğimiz\" with our novel root \"dondı\" to get the final answer \"dondılaşabileceğimiz\".\n\nFinal answer: <Answer>dondılaşabileceğimiz</Answer>",
            "id_root": "karşı",
            "ood_root": "dondı",
            "id_derivation": "karşılaşabileceğimiz",
            "answer_suffix": "\n\nNow we replace the root \"karşı\" in \"karşılaşabileceğimiz\" with our novel root \"dondı\" to get the final answer \"dondılaşabileceğimiz\".\n\nFinal answer: <Answer>dondılaşabileceğimiz</Answer>"
        },
        {
            "id": "tr-btwd-2a4598dc",
            "root": "mınar",
            "prefixes": [],
            "suffixes": [
                "ımız",
                "a",
                "ma",
                "lar",
                "la",
                "dık"
            ],
            "meta_prefixes": [],
            "meta_suffixes": [
                "HmHz",
                "YA",
                "mA",
                "lAr",
                "YlA",
                "DHk"
            ],
            "derivation": "mınaramadıklarımızla",
            "reference": "mınaramadıklarımızla",
            "sentence": "kader bizden ömrümüzün bir yarısını almış, seneler uzun ince bir yol gibi akmış gitmiş ve bizler yine saplantılarımızla, ___ ve umutsuzluğumuzla baş başa kalmışız",
            "cot_answer": "To answer the question, we will first use the novel word's definition to derive an existing word in Turkish that has the same meaning and then replace the root in this derivation with the given novel root. Given novel root \"mınar\" is defined to mean \"başar\", so let's first try to derive a new word from \"başar\" using the given affixes. To construct a grammatically correct word in Turkish, we need to follow the rules of Turkish morphology and syntax. We will append the affixes to the root \"başar\" in a logical order to create a meaningful word.\n\n1. \"başar\" (root) - to succeed\n2. \"başar + a\" - to be able to suceed\n3. \"başar + a + ma\" (negation) - not to succeed\n4. \"başar + a + ma + dık\" (past tense for negative) - we could not succeed\n5. \"başar + a + ma + dık + lar\" (first person plural) - this is redundant since \"ımız\" already indicates first person plural, but in Turkish, sometimes double plural markers are used for emphasis or collective meaning\n6. \"başar + a + ma + dık + lar + ımız\" (plural suffix) - the ones where we could not succeed\n7. \"başar + a + ma + dık + lar + ımız + la\" (instrumental/comitative case) - with the ones where we could not succeed\n\nThe final constructed word is \"başaramadıklarımızla\".\n\nAll affixes have been used exactly once, and no extra affixes have been included.\n\nNow we replace the root \"başar\" in \"başaramadıklarımızla\" with our novel root \"mınar\" to get the final answer \"mınaramadıklarımızla\".\n\nFinal answer: <Answer>mınaramadıklarımızla</Answer>",
            "id_root": "başar",
            "ood_root": "mınar",
            "id_derivation": "başaramadıklarımızla",
            "answer_suffix": "\n\nNow we replace the root \"başar\" in \"başaramadıklarımızla\" with our novel root \"mınar\" to get the final answer \"mınaramadıklarımızla\".\n\nFinal answer: <Answer>mınaramadıklarımızla</Answer>"
        },
        {
            "id": "tr-btwd-f02d68da",
            "root": "garak",
            "prefixes": [],
            "suffixes": [
                "ecek",
                "abil",
                "ıl",
                "ler",
                "i",
                "ni"
            ],
            "meta_prefixes": [],
            "meta_suffixes": [
                "YAcAk",
                "YAbil",
                "Hl",
                "lAr",
                "SH",
                "NH"
            ],
            "derivation": "garakılabileceklerini",
            "reference": "garakılabileceklerini",
            "sentence": "i̇nsanların kolay kandırılabileceklerini, çok ani duygu değişimleri yaşayabileceklerini, kolayca güvenebilip kolayca yüzüstü ___ gözler önüne seriyor bu eser",
            "cot_answer": "To answer the question, we will first use the novel word's definition to derive an existing word in Turkish that has the same meaning and then replace the root in this derivation with the given novel root. Given novel root \"garak\" is defined to mean \"bırak\", so let's first try to derive a new word from \"bırak\" using the given affixes. To construct a grammatically correct word in Turkish, we need to follow the rules of Turkish morphology and syntax. We will start with the root \"bırak\" and then add the affixes in a logical order to create a meaningful word.\n\n1. Root: bırak\n2. Future tense: ecek (bırakacak)\n3. Ability mood: abil (bırakabilecek)\n4. Passive voice: ıl (bırakılabilecek)\n5. Third person plural: ler (bırakılabilecekler)\n6. Accusative case: i (bırakılabilecekleri)\n7. Genitive case: ni (bırakılabileceklerini)\n\nNow, let's put them all together:\n\nbırak + abil + ecek + ıl + ler + i + ni = bırakılabileceklerini\n\nEach affix is used exactly once, all provided affixes are used, and no extra affixes are included.\n\nNow we replace the root \"bırak\" in \"bırakılabileceklerini\" with our novel root \"garak\" to get the final answer \"garakılabileceklerini\".\n\nFinal answer: <Answer>garakılabileceklerini</Answer>",
            "id_root": "bırak",
            "ood_root": "garak",
            "id_derivation": "bırakılabileceklerini",
            "answer_suffix": "\n\nNow we replace the root \"bırak\" in \"bırakılabileceklerini\" with our novel root \"garak\" to get the final answer \"garakılabileceklerini\".\n\nFinal answer: <Answer>garakılabileceklerini</Answer>"
        },
        {
            "id": "tr-btwd-f5b87e55",
            "root": "sagak",
            "prefixes": [],
            "suffixes": [
                "lar",
                "ın",
                "ı",
                "la",
                "dık",
                "ma"
            ],
            "meta_prefixes": [],
            "meta_suffixes": [
                "lAr",
                "Hn",
                "NH",
                "lA",
                "DHk",
                "mA"
            ],
            "derivation": "sagaklamadıklarını",
            "reference": "sagaklamadıklarını",
            "sentence": "bugüne kadar ___ da kucaklamalı ki teröre karşı, insanlık düşmanlarına karşı tek bir cephe oluşabilsin, insanlık ayakta sağlam durabilsin",
            "cot_answer": "To answer the question, we will first use the novel word's definition to derive an existing word in Turkish that has the same meaning and then replace the root in this derivation with the given novel root. Given novel root \"sagak\" is defined to mean \"kucak\", so let's first try to derive a new word from \"kucak\" using the given affixes. First, let's determine the order of the affixes to create a grammatically correct word in Turkish. The root word \"kucak\" means \"lap\" or \"embrace\" in English. We need to follow Turkish grammar rules, which typically involve adding suffixes in a certain order, such as making the word plural, then adding tense, case, etc.\n\n1. kucak + la = kucakla (embrace with)\n2. kucakla + ma = kucaklama (do not embrace)\n3. kucaklama + dık = kucaklamadık (we did not embrace)\n4. kucaklamadık + lar = kucaklamadıklar (those that we did not embrace)\n5. kucaklamadıklar + ın = kucaklamadıkların (of those that we did not embrace)\n6. kucaklamadıkların + ı = kucaklamadıklarını (those that you did not embrace - accusative case)\n\nNow we have a grammatically correct word in Turkish. Each affix is used exactly once, all provided affixes are used, and no extra affixes are included.\n\nNow we replace the root \"kucak\" in \"kucaklamadıklarını\" with our novel root \"sagak\" to get the final answer \"sagaklamadıklarını\".\n\nFinal answer: <Answer>sagaklamadıklarını</Answer>",
            "id_root": "kucak",
            "ood_root": "sagak",
            "id_derivation": "kucaklamadıklarını",
            "answer_suffix": "\n\nNow we replace the root \"kucak\" in \"kucaklamadıklarını\" with our novel root \"sagak\" to get the final answer \"sagaklamadıklarını\".\n\nFinal answer: <Answer>sagaklamadıklarını</Answer>"
        },
        {
            "id": "tr-btwd-5641d8fd",
            "root": "dımyı",
            "prefixes": [],
            "suffixes": [
                "lar",
                "ma",
                "ı",
                "ma",
                "ın",
                "lan"
            ],
            "meta_prefixes": [],
            "meta_suffixes": [
                "lAr",
                "mA",
                "NH",
                "mA",
                "Hn",
                "lAn"
            ],
            "derivation": "dımyılanmamalarını",
            "reference": "dımyılanmamalarını",
            "sentence": "geçmişi geçmişte bırakmalarını, gelecek içinde ___ söyleyen tarancı, en önemli zamanın şu an yaşadıkları zaman olduğunu ve bunu çok iyi bir şekilde değerlendirmeleri gerektiğini öğüt vermiştir",
            "cot_answer": "To answer the question, we will first use the novel word's definition to derive an existing word in Turkish that has the same meaning and then replace the root in this derivation with the given novel root. Given novel root \"dımyı\" is defined to mean \"kaygı\", so let's first try to derive a new word from \"kaygı\" using the given affixes. First, let's list the affixes provided:\n\n1. lar\n2. ma (first occurrence)\n3. ı\n4. ma (second occurrence)\n5. ın\n6. lan\n\nNow, let's construct the word step by step:\n\n1. Start with the root: kaygı\n2. Add the causative affix \"lan\" to make it a verb: kaygılan\n3. Add the negation affix \"ma\" (first occurrence): kaygılanma\n4. Add the potential affix \"ma\" (second occurrence): kaygılanmama\n5. Add the possessive affix \"ın\": kaygılanmamanın\n6. Add the accusative affix \"ı\": kaygılanmamanını\n7. Add the plural affix \"lar\": kaygılanmamanınlar\n\nHowever, the last step is incorrect because the plural affix \"lar\" cannot be directly added to the possessive form in Turkish. The correct order should be:\n\n1. Start with the root: kaygı\n2. Add the causative affix \"lan\": kaygılan\n3. Add the negation affix \"ma\" (first occurrence): kaygılanma\n4. Add the potential affix \"ma\" (second occurrence): kaygılanmama\n5. Add the plural affix \"lar\": kaygılanmamalar\n6. Add the possessive affix \"ın\": kaygılanmamaların\n7. Add the accusative affix \"ı\": kaygılanmamalarını\n\nThe correct word constructed by using each affix exactly once and in a grammatically correct order. All affixes have been used exactly once, and no extra affixes have been included.\n\nNow we replace the root \"kaygı\" in \"kaygılanmamalarını\" with our novel root \"dımyı\" to get the final answer \"dımyılanmamalarını\".\n\nFinal answer: <Answer>dımyılanmamalarını</Answer>",
            "id_root": "kaygı",
            "ood_root": "dımyı",
            "id_derivation": "kaygılanmamalarını",
            "answer_suffix": "\n\nNow we replace the root \"kaygı\" in \"kaygılanmamalarını\" with our novel root \"dımyı\" to get the final answer \"dımyılanmamalarını\".\n\nFinal answer: <Answer>dımyılanmamalarını</Answer>"
        },
        {
            "id": "tr-btwd-d59865df",
            "root": "yanmu",
            "prefixes": [],
            "suffixes": [
                "i",
                "la",
                "dik",
                "ler",
                "ni",
                "yabil"
            ],
            "meta_prefixes": [],
            "meta_suffixes": [
                "NH",
                "lA",
                "DHk",
                "lAr",
                "SH",
                "YAbil"
            ],
            "derivation": "yanmulayabildiklerini",
            "reference": "yanmulayabildiklerini",
            "sentence": "aslında onların çelişkilerinden ya da kötü düşüncelerinden çok,onların gerçekleri herkesten ne kadar iyi bildiğini, ne kadar geniş düşünebildiklerini, varoluşlarındaki amacı, çevrelerini ne kadar iyi ___ ve en önemlisi de kendi benliklerini, düşündüklerini tüm çıplaklığıyla ne kadar yüksek sesle haykırabildiklerini göstermiş.",
            "cot_answer": "To answer the question, we will first use the novel word's definition to derive an existing word in Turkish that has the same meaning and then replace the root in this derivation with the given novel root. Given novel root \"yanmu\" is defined to mean \"sorgu\", so let's first try to derive a new word from \"sorgu\" using the given affixes. To construct a grammatically correct word in Turkish, we need to follow the rules of Turkish morphology and syntax. We will append the affixes to the root \"sorgu\" in a way that makes sense in Turkish grammar.\n\n1. \"sorgu\" (interrogation)\n2. \"sorgu\" + \"la\" = \"sorgula\" (interrogate)\n3. \"sorgula\" + \"yabil\" = \"sorgulayabil\" (can interrogate)\n4. \"sorgulayabil\" + \"dik\" = \"sorgulayabildik\" (we were able to interrogate)\n5. \"sorgulayabildik\" + \"i\" = \"sorgulayabildiği\" (that he/she/it was able to interrogate)\n6. \"sorgulayabildiği\" + \"ni\" = \"sorgulayabildiğini\" (that he/she/it was able to interrogate - accusative case, often used to indicate direct object of a verb)\n7. \"sorgulayabildiğini\" + \"ler\" = \"sorgulayabildiklerini\" (that they were able to interrogate - plural)\n\nNow we replace the root \"sorgu\" in \"sorgulayabildiklerini\" with our novel root \"yanmu\" to get the final answer \"yanmulayabildiklerini\".\n\nFinal answer: <Answer>yanmulayabildiklerini</Answer>",
            "id_root": "sorgu",
            "ood_root": "yanmu",
            "id_derivation": "sorgulayabildiklerini",
            "answer_suffix": "\n\nNow we replace the root \"sorgu\" in \"sorgulayabildiklerini\" with our novel root \"yanmu\" to get the final answer \"yanmulayabildiklerini\".\n\nFinal answer: <Answer>yanmulayabildiklerini</Answer>"
        },
        {
            "id": "tr-btwd-fa478a1a",
            "root": "ölkektneyel",
            "prefixes": [],
            "suffixes": [
                "leş",
                "me",
                "tir",
                "il",
                "si",
                "nin"
            ],
            "meta_prefixes": [],
            "meta_suffixes": [
                "lAş",
                "mA",
                "DHr",
                "Hl",
                "sH",
                "NHn"
            ],
            "derivation": "ölkektneyelleştirilmesinin",
            "reference": "ölkektneyelleştirilmesinin",
            "sentence": "futbolun spor özünden koparılıp ___ enbasit örnekleri; birbirine benzeyen ve para ile başarıya endekslenmiş taraftar modeli yaratmak vebelki de futbolun en güzel yanlarından biri olan birliktelik ve tribün olgusuna ticari bir anlameklemektir",
            "cot_answer": "To answer the question, we will first use the novel word's definition to derive an existing word in Turkish that has the same meaning and then replace the root in this derivation with the given novel root. Given novel root \"ölkektneyel\" is defined to mean \"endüstriyel\", so let's first try to derive a new word from \"endüstriyel\" using the given affixes. To construct a grammatically correct word in Turkish, we need to follow the rules of Turkish morphology and syntax. We will append the affixes to the root \"endüstriyel\" in a logical order to create a meaningful word.\n\n1. \"leş\" - This affix turns the root into a verb meaning \"to become like\" or \"to turn into.\"\n2. \"me\" - This is a negation suffix for verbs.\n3. \"tir\" - This is a causative suffix, which turns the verb into a form meaning \"to make/do.\"\n4. \"il\" - This is a passive suffix, which turns the verb into a passive form.\n5. \"si\" - This is a possessive suffix for third person singular.\n6. \"nin\" - This is a genitive suffix, indicating possession or relation.\n\nNow, let's construct the word step by step:\n\n1. endüstriyel + leş = endüstriyelleş (to become industrial)\n2. endüstriyelleş + me = endüstriyelleşme (not to become industrial)\n3. endüstriyelleşme + tir = endüstriyelleştirme (to prevent from becoming industrial)\n4. endüstriyelleştirme + il = endüstriyelleştirilme (to be prevented from becoming industrial)\n5. endüstriyelleştirilme + si = endüstriyelleştirilmesi (his/her/its being prevented from becoming industrial)\n6. endüstriyelleştirilmesi + nin = endüstriyelleştirilmesinin (of his/her/its being prevented from becoming industrial)\n\nThe final constructed word is \"endüstriyelleştirilmesinin.\"\n\nAll provided affixes are used exactly once, and no extra affixes are included.\n\nNow we replace the root \"endüstriyel\" in \"endüstriyelleştirilmesinin\" with our novel root \"ölkektneyel\" to get the final answer \"ölkektneyelleştirilmesinin\".\n\nFinal answer: <Answer>ölkektneyelleştirilmesinin</Answer>",
            "id_root": "endüstriyel",
            "ood_root": "ölkektneyel",
            "id_derivation": "endüstriyelleştirilmesinin",
            "answer_suffix": "\n\nNow we replace the root \"endüstriyel\" in \"endüstriyelleştirilmesinin\" with our novel root \"ölkektneyel\" to get the final answer \"ölkektneyelleştirilmesinin\".\n\nFinal answer: <Answer>ölkektneyelleştirilmesinin</Answer>"
        },
        {
            "id": "tr-btwd-9472432f",
            "root": "otfal",
            "prefixes": [],
            "suffixes": [
                "ma",
                "lar",
                "tır",
                "a",
                "dık",
                "ı",
                "laş"
            ],
            "meta_prefixes": [],
            "meta_suffixes": [
                "mA",
                "lAr",
                "DHr",
                "YA",
                "DHk",
                "YH",
                "lAş"
            ],
            "derivation": "otfallaştıramadıkları",
            "reference": "otfallaştıramadıkları",
            "cot_answer": "To answer the question, we will first use the novel word's definition to derive an existing word in Turkish that has the same meaning and then replace the root in this derivation with the given novel root. Given novel root \"otfal\" is defined to mean \"aptal\", so let's first try to derive a new word from \"aptal\" using the given affixes. To construct a grammatically correct word in Turkish, we need to follow the rules of Turkish morphology and syntax. We will append the affixes to the root \"aptal\" in a logical order to create a meaningful word.\n\n1. \"aptal\" (stupid)\n2. \"aptallaş\" (to become stupid) - Adding the affix \"laş\" which indicates a process or change.\n3. \"aptallaştır\" (to make it become stupid) - Adding the affix \"tır\" which is a causative form.\n4. \"aptallaştıra\" (to be able to make it become stupid) - Adding the affix \"a\" which is used for the ability mood.\n5. \"aptallaştırama\" (not be able to make it become stupid) - Adding the affix \"ma\" which negates the verb.\n6. \"aptallaştıramadık\" (that we could not make become stupid) - Adding the affix \"dık\" which is used for past participle.\n7. \"aptallaştıramadıkları\" (those they could not make become stupid) - Adding the affix \"lar\" which is a plural suffix and adding the affix \"ı\" which is a possessive/agreement suffix for 'they'.\n\nNow, let's verify the rules:\n- No affix is used more than once.\n- All provided affixes are used.\n- No extra affixes outside the provided list are included.\n\nNow we replace the root \"aptal\" in \"aptallaştıramadıkları\" with our novel root \"otfal\" to get the final answer \"otfallaştıramadıkları\".\n\nFinal answer: <Answer>otfallaştıramadıkları</Answer>",
            "id_root": "aptal",
            "ood_root": "otfal",
            "id_derivation": "aptallaştıramadıkları",
            "answer_suffix": "\n\nNow we replace the root \"aptal\" in \"aptallaştıramadıkları\" with our novel root \"otfal\" to get the final answer \"otfallaştıramadıkları\".\n\nFinal answer: <Answer>otfallaştıramadıkları</Answer>"
        },
        {
            "id": "tr-btwd-84acf228",
            "root": "simel",
            "prefixes": [],
            "suffixes": [
                "leş",
                "si",
                "tir",
                "me",
                "i",
                "n",
                "il"
            ],
            "meta_prefixes": [],
            "meta_suffixes": [
                "lAş",
                "sH",
                "DHr",
                "mA",
                "NH",
                "Hl",
                "Hn"
            ],
            "derivation": "simelleştirilmesini",
            "reference": "simelleştirilmesini",
            "cot_answer": "To answer the question, we will first use the novel word's definition to derive an existing word in Turkish that has the same meaning and then replace the root in this derivation with the given novel root. Given novel root \"simel\" is defined to mean \"genel\", so let's first try to derive a new word from \"genel\" using the given affixes. To construct a grammatically correct word in Turkish, we need to follow the rules of Turkish morphology and syntax. We will append the affixes to the root \"genel\" in a logical order to create a meaningful word.\n\n1. \"genel\" (general)\n2. \"genel\" + \"leş\" = \"genelleş\" (to become general)\n3. \"genelleş\" + \"tir\" = \"genelleştir\" (to make something general)\n4. \"genelleştir\" + \"il\" = \"genelleştiril\" (to be made general - passive voice)\n5. \"genelleştiril\" + \"me\" = \"genelleştirilme\" (the act of being made general - noun form)\n6. \"genelleştirilme\" + \"si\" = \"genelleştirilmesi\" (his/her/its being made general - possessive)\n7. \"genelleştirilmesi\" + \"n\" = \"genelleştirilmesin\" (should not be made general - negative imperative)\n8. \"genelleştirilmesin\" + \"i\" = \"genelleştirilmesini\" (the act of it not being made general - accusative case)\n\nNow, let's list each affix used in the construction of the word to verify adherence to the rules:\n\n- \"leş\" (become)\n- \"tir\" (make/causative)\n- \"il\" (passive)\n- \"me\" (noun form)\n- \"si\" (possessive)\n- \"n\" (negative imperative)\n- \"i\" (accusative case)\n\nAll affixes have been used exactly once, and no extra affixes have been included.\n\nNow we replace the root \"genel\" in \"genelleştirilmesini\" with our novel root \"simel\" to get the final answer \"simelleştirilmesini\".\n\nFinal answer: <Answer>simelleştirilmesini</Answer>",
            "id_root": "genel",
            "ood_root": "simel",
            "id_derivation": "genelleştirilmesini",
            "answer_suffix": "\n\nNow we replace the root \"genel\" in \"genelleştirilmesini\" with our novel root \"simel\" to get the final answer \"simelleştirilmesini\".\n\nFinal answer: <Answer>simelleştirilmesini</Answer>"
        },
        {
            "id": "tr-btwd-ca69659d",
            "root": "pakol",
            "prefixes": [],
            "suffixes": [
                "suz",
                "um",
                "tır",
                "laş",
                "ma",
                "ıl",
                "sı"
            ],
            "meta_prefixes": [],
            "meta_suffixes": [
                "sHz",
                "Hm",
                "DHr",
                "lAş",
                "mA",
                "Hl",
                "SH"
            ],
            "derivation": "pakolumsuzlaştırılması",
            "reference": "pakolumsuzlaştırılması",
            "cot_answer": "To answer the question, we will first use the novel word's definition to derive an existing word in Turkish that has the same meaning and then replace the root in this derivation with the given novel root. Given novel root \"pakol\" is defined to mean \"ol\", so let's first try to derive a new word from \"ol\" using the given affixes. To construct a grammatically correct word in Turkish, we need to follow the rules of Turkish morphology and syntax. We will append the affixes to the root \"ol\" in a logical order to create a meaningful word.\n\n1. \"ol\" (to become)\n2. \"ol\" + \"um\" = \"olum\" (the state of becoming)\n3. \"olum\" + \"suz\" = \"olumsuz\" (negative)\n4. \"olumsuz\" + \"laş\" = \"olumsuzlaş\" (to become negative)\n5. \"olumsuzlaş\" + \"tır\" = \"olumsuzlaştır\" (make it to become negative)\n6. \"olumsuzlaştır\" + \"ıl\" = \"olumsuzlaştırıl\" (to be made negative - passive voice)\n7. \"olumsuzlaştırıl\" + \"ma\" = \"olumsuzlaştırılma\" (the act of being made negative - noun form)\n8. \"olumsuzlaştırılma\" + \"sı\" = \"olumsuzlaştırılması\" (his/her/its being made negative - possessive)\n\nNow, let's list each affix used in the construction of the word to verify adherence to the rules:\n\n- \"um\" (the state of)\n- \"suz\" (without)\n- \"laş\" (become)\n- \"tır\" (make/causative)\n- \"ıl\" (passive)\n- \"ma\" (noun form)\n- \"sı\" (possesive)\n\nAll affixes have been used exactly once, and no extra affixes have been included.\n\nNow we replace the root \"ol\" in \"olumsuzlaştırılması\" with our novel root \"pakol\" to get the final answer \"pakolumsuzlaştırılması\".\n\nFinal answer: <Answer>pakolumsuzlaştırılması</Answer>",
            "id_root": "ol",
            "ood_root": "pakol",
            "id_derivation": "olumsuzlaştırılması",
            "answer_suffix": "\n\nNow we replace the root \"ol\" in \"olumsuzlaştırılması\" with our novel root \"pakol\" to get the final answer \"pakolumsuzlaştırılması\".\n\nFinal answer: <Answer>pakolumsuzlaştırılması</Answer>"
        },
        {
            "id": "tr-btwd-958e6ae5",
            "root": "koypu",
            "prefixes": [],
            "suffixes": [
                "laş",
                "tan",
                "tır",
                "ma",
                "a",
                "mak",
                "sal"
            ],
            "meta_prefixes": [],
            "meta_suffixes": [
                "lAş",
                "DAn",
                "DHr",
                "mA",
                "YA",
                "mAk",
                "sAl"
            ],
            "derivation": "koypusallaştıramamaktan",
            "reference": "koypusallaştıramamaktan",
            "cot_answer": "To answer the question, we will first use the novel word's definition to derive an existing word in Turkish that has the same meaning and then replace the root in this derivation with the given novel root. Given novel root \"koypu\" is defined to mean \"duygu\", so let's first try to derive a new word from \"duygu\" using the given affixes. To construct a grammatically correct word in Turkish, we need to follow the rules of Turkish morphology and syntax. We will append the affixes to the root \"duygu\" in a logical order to create a meaningful word.\n\n1. \"duygu\" (emotion)\n2. \"duygu\" + \"sal\" = \"duygusal\" (emotional)\n3. \"duygusal\" + \"laş\" = \"duygusallaş\" (to become emotional)\n4. \"duygusallaş\" + \"tır\" = \"duygusallaştır\" (to make it become emotional)\n5. \"duygusallaştır\" + \"a\" = \"duygusallaştıra\" (be able to make it become emotional)\n6. \"duygusallaştıra\" + \"ma\" = \"duygusallaştırama\" (not be able to make it become emotional)\n7. \"duygusallaştırama\" + \"mak\" = \"duygusallaştıramamak\" (to not be able to make it become emotional - infinitive form)\n8. \"duygusallaştıramamak\" + \"tan\" = \"duygusallaştıramamaktan\" (from not being able to make it become emotional)\n\nNow, let's list each affix used in the construction of the word to verify adherence to the rules:\n\n- \"sal\" (adjective making suffix)\n- \"laş\" (become)\n- \"tır\" (make/causative)\n- \"a\" (be able to)\n- \"ma\" (not be able to, negation)\n- \"mak\" (infinitive making suffix)\n- \"tan\" (ablative)\n\nAll affixes have been used exactly once, and no extra affixes have been included.\n\nNow we replace the root \"duygu\" in \"duygusallaştıramamaktan\" with our novel root \"koypu\" to get the final answer \"koypusallaştıramamaktan\".\n\nFinal answer: <Answer>koypusallaştıramamaktan</Answer>",
            "id_root": "duygu",
            "ood_root": "koypu",
            "id_derivation": "duygusallaştıramamaktan",
            "answer_suffix": "\n\nNow we replace the root \"duygu\" in \"duygusallaştıramamaktan\" with our novel root \"koypu\" to get the final answer \"koypusallaştıramamaktan\".\n\nFinal answer: <Answer>koypusallaştıramamaktan</Answer>"
        },
        {
            "id": "tr-btwd-d22814ef",
            "root": "udıl",
            "prefixes": [],
            "suffixes": [
                "ı",
                "lan",
                "yacağ",
                "ıl",
                "ma",
                "ın",
                "dır"
            ],
            "meta_prefixes": [],
            "meta_suffixes": [
                "NH",
                "lAn",
                "YAcAk",
                "Hl",
                "mA",
                "Hn",
                "DHr"
            ],
            "derivation": "udıllandırılmayacağını",
            "reference": "udıllandırılmayacağını",
            "cot_answer": "To answer the question, we will first use the novel word's definition to derive an existing word in Turkish that has the same meaning and then replace the root in this derivation with the given novel root. Given novel root \"udıl\" is defined to mean \"akıl\", so let's first try to derive a new word from \"akıl\" using the given affixes. To construct a grammatically correct word in Turkish, we need to follow the rules of Turkish morphology and syntax. We will append the affixes to the root \"akıl\" in a logical order to create a meaningful word.\n\n1. \"akıl\" (intellect)\n2. \"akıl\" + \"lan\" = \"akıllan\" (become intelligent)\n3. \"akıllan\" + \"dır\" = \"akıllandır\" (to make it become intelligent)\n4. \"akıllandır\" + \"ıl\" = \"akıllandırıl\" (to be made become intelligent)\n5. \"akıllandırıl\" + \"ma\" = \"akıllandırılma\" (not be made become intelligent)\n6. \"akıllandırılma\" + \"yacağ\" = \"akıllandırılmayacağ\" (will not be made become intelligent)\n7. \"akıllandırılmayacağ\" + \"ın\" = \"akıllandırılmayacağın\" (of you not be made become intelligent)\n8. \"akıllandırılmayacağın\" + \"ı\" = \"akıllandırılmayacağını\" (you not be made become intelligent)\n\nNow, let's list each affix used in the construction of the word to verify adherence to the rules:\n\n- \"lan\" (become)\n- \"dır\" (make/causative)\n- \"ıl\" (passive)\n- \"ma\" (negation)\n- \"yacağ\" (future tense)\n- \"ın\" (possesive)\n- \"ı\" (accusative)\n\nAll affixes have been used exactly once, and no extra affixes have been included.\n\nNow we replace the root \"akıl\" in \"akıllandırılmayacağını\" with our novel root \"udıl\" to get the final answer \"udıllandırılmayacağını\".\n\nFinal answer: <Answer>udıllandırılmayacağını</Answer>",
            "id_root": "akıl",
            "ood_root": "udıl",
            "id_derivation": "akıllandırılmayacağını",
            "answer_suffix": "\n\nNow we replace the root \"akıl\" in \"akıllandırılmayacağını\" with our novel root \"udıl\" to get the final answer \"udıllandırılmayacağını\".\n\nFinal answer: <Answer>udıllandırılmayacağını</Answer>"
        }
    ]
}